{"schema_version":1,"plan_id":"live-applier-001","inspected_project":{"name":"[Unsaved project]","path":"","project_change_count":20},"items":[{"id":"color-drums","verb":"set_track_color","target":{"track_guid":"{771C2680-B9FA-2B48-AD94-ADFFA0A2A90C}"},"payload":{"color":{"red":220,"green":40,"blue":30}},"reason":"live spike: drums are red"},{"id":"rename-marker-1","verb":"rename_marker","target":{"marker_id":1,"snapshot_name":"chorus"},"payload":{"new_name":"Chorus"},"reason":"live spike: Title Case"},{"id":"rename-region-202","verb":"rename_region","target":{"marker_id":202,"snapshot_name":"chorus 2"},"payload":{"new_name":"Chorus 2"},"reason":"live spike: Title Case"},{"id":"delete-marker-2","verb":"delete_marker","target":{"marker_id":2,"snapshot_name":"chorus","snapshot_position_seconds":10},"payload":{"survivor_marker_id":1},"reason":"live spike: exact duplicate"}]}
